{"$id":"https://outerheavenx.github.io/citadel-of-vesper/schemas/enemy.schema.json","$schema":"https://json-schema.org/draft/2020-12/schema","additionalProperties":false,"description":"Enemy definition. All enemies are original designs — never recreate Castlevania enemies.","properties":{"behaviors":{"description":"AI behavior flags (spec §35).","items":{"enum":["patrol","pursue","retreat","leap","dodge","block","teleport","fly","crawl","ambush","cast","summon","charge"]},"type":"array"},"drops":{"items":{"additionalProperties":false,"properties":{"chance":{"maximum":1,"minimum":0,"type":"number"},"itemId":{"type":"string"},"quantity":{"minimum":1,"type":"integer"}},"required":["itemId","chance"],"type":"object"},"type":"array"},"hp":{"minimum":1,"type":"integer"},"id":{"pattern":"^[a-z0-9_]+$","type":"string"},"level":{"minimum":1,"type":"integer"},"lore":{"type":"string"},"name":{"type":"string"},"resistances":{"additionalProperties":{"minimum":0,"type":"number"},"type":"object"},"sprite":{"type":"string"},"stats":{"additionalProperties":false,"properties":{"attack":{"type":"number"},"defense":{"type":"number"},"speed":{"type":"number"}},"required":["attack","defense"],"type":"object"},"telegraphs":{"description":"Named attack telegraphs; every attack must have one.","items":{"additionalProperties":false,"properties":{"attack":{"type":"string"},"flash":{"type":"boolean"},"sound":{"type":"string"},"windup":{"type":"number"}},"required":["attack","windup"],"type":"object"},"type":"array"},"weaknesses":{"items":{"enum":["physical","fire","ice","lightning","shadow","holy"]},"type":"array"},"xp":{"minimum":0,"type":"integer"}},"required":["id","name","level","hp","stats","behaviors","drops","xp","sprite","lore"],"title":"Enemy","type":"object"}