[{"behaviors":["patrol","pursue","leap"],"drops":[{"chance":0.12,"itemId":"ember_tonic","quantity":1}],"hp":24,"id":"ash_hound","level":2,"lore":"Once the gate watch's hunting dogs. The ash took them first, and they never stopped patrolling.","name":"Ash Hound","resistances":{"fire":0.25},"sprite":"ash_hound","stats":{"attack":9,"defense":2,"speed":110},"telegraphs":[{"attack":"pounce","flash":true,"sound":"hound_growl","windup":0.45}],"weaknesses":["holy"],"xp":30},{"behaviors":["patrol","pursue","block"],"drops":[{"chance":0.2,"itemId":"ember_tonic","quantity":1},{"chance":0.04,"itemId":"iron_signet","quantity":1}],"hp":40,"id":"rustbound_revenant","level":4,"lore":"A fallen gate-soldier sealed inside rusted plate. It raises its shield out of habit, not malice.","name":"Rustbound Revenant","resistances":{"physical":0.2},"sprite":"rustbound_revenant","stats":{"attack":14,"defense":6,"speed":55},"telegraphs":[{"attack":"overhead_cleave","flash":true,"sound":"blade_scrape","windup":0.6}],"weaknesses":["lightning","holy"],"xp":60},{"behaviors":["fly","cast"],"drops":[{"chance":0.15,"itemId":"vesper_draught","quantity":1}],"hp":30,"id":"cinder_wisp","level":5,"lore":"A coal that never finished burning. It drifts the keep's halls looking for something warm to become.","name":"Cinder Wisp","resistances":{"fire":0.5},"sprite":"cinder_wisp","stats":{"attack":12,"defense":2,"speed":70},"telegraphs":[{"attack":"ember_lob","flash":true,"sound":"wisp_hiss","windup":0.5}],"weaknesses":["ice","holy"],"xp":65},{"behaviors":["patrol","pursue"],"drops":[{"chance":0.18,"itemId":"ember_tonic","quantity":1},{"chance":0.03,"itemId":"wayfarer_coat","quantity":1}],"hp":64,"id":"hollow_sentinel","level":6,"lore":"Armor with no knight inside, only the violet hollow where orders used to be. It still walks its rounds.","name":"Hollow Sentinel","resistances":{"physical":0.25},"sprite":"hollow_sentinel","stats":{"attack":16,"defense":6,"speed":45},"telegraphs":[{"attack":"spear_sweep","flash":true,"sound":"swing_sword","windup":0.55}],"weaknesses":["lightning"],"xp":90},{"behaviors":["fly","teleport","ambush","cast"],"drops":[{"chance":0.16,"itemId":"vesper_draught","quantity":1},{"chance":0.03,"itemId":"moonstone_charm","quantity":1}],"hp":38,"id":"vellum_phantom","level":6,"lore":"A burned archive ledger that refused to be unread. It folds the air like a page and bites with other people's words.","name":"Vellum Phantom","resistances":{"shadow":0.4},"sprite":"vellum_phantom","stats":{"attack":14,"defense":3,"speed":85},"telegraphs":[{"attack":"spectral_bolt","flash":true,"sound":"page_rustle","windup":0.45}],"weaknesses":["fire","holy"],"xp":95},{"behaviors":["cast"],"drops":[{"itemId":"vesper_draught","chance":0.25,"quantity":1},{"itemId":"ember_tonic","chance":0.1,"quantity":3}],"hp":95,"id":"vesper_chimer","level":7,"lore":"A cracked vesper bell that learned to ring itself. When it finds its tone, the floor answers.","name":"Vesper Chimer","resistances":{"lightning":0.3,"physical":0.3},"sprite":"vesper_chimer","stats":{"attack":18,"defense":10,"speed":20},"telegraphs":[{"attack":"resonance_ring","flash":true,"sound":"bell_chime","windup":0.9}],"weaknesses":["holy"],"xp":150},{"behaviors":["crawl","leap"],"drops":[{"chance":0.1,"itemId":"ember_tonic","quantity":1}],"hp":26,"id":"mote_swarm","level":5,"lore":"Dust, ash, and the keep's shed skins, holding a grudge together. It moves like spilled mercury and bites like nettles.","name":"Mote Swarm","resistances":{"physical":0.15},"sprite":"mote_swarm","stats":{"attack":8,"defense":1,"speed":135},"telegraphs":[{"attack":"skitter_pounce","flash":true,"sound":"swarm_chitter","windup":0.3}],"weaknesses":["fire"],"xp":60},{"behaviors":["pursue","charge","retreat"],"drops":[{"itemId":"ember_tonic","chance":0.3,"quantity":1},{"itemId":"vesper_draught","chance":0.08,"quantity":2}],"hp":135,"id":"cinder_mastiff","level":8,"lore":"The pack-leader the ash hounds follow. Its mane never stopped smoldering, and neither did its temper.","name":"Cinder Mastiff","resistances":{"fire":0.4},"sprite":"cinder_mastiff","stats":{"attack":22,"defense":8,"speed":95},"telegraphs":[{"attack":"savage_charge","flash":true,"sound":"hound_growl","windup":0.7},{"attack":"twin_rend","flash":true,"sound":"swing_sabre","windup":0.5}],"weaknesses":["holy","ice"],"xp":240}]